<?xml version="1.0" encoding="UTF-8"?>
<xsd:schema xmlns:xsd="http://www.w3.org/2001/XMLSchema" xmlns:od="urn:schemas-microsoft-com:officedata">
<xsd:element name="dataroot">
<xsd:complexType>
<xsd:sequence>
<xsd:element ref="DETAIL" minOccurs="0" maxOccurs="unbounded"/>
</xsd:sequence>
<xsd:attribute name="generated" type="xsd:dateTime"/>
</xsd:complexType>
</xsd:element>
<xsd:element name="DETAIL">
<xsd:annotation>
<xsd:appinfo/>
</xsd:annotation>
<xsd:complexType>
<xsd:sequence>
<xsd:element name="faction" minOccurs="0" od:jetType="text" od:sqlSType="nvarchar">
<xsd:simpleType>
<xsd:restriction base="xsd:string">
<xsd:maxLength value="255"/>
</xsd:restriction>
</xsd:simpleType>
</xsd:element>
<xsd:element name="idTournee" minOccurs="1" od:jetType="autonumber" od:sqlSType="int" od:autoUnique="yes" od:nonNullable="yes" type="xsd:int"/>
<xsd:element name="dateTournee" minOccurs="0" od:jetType="datetime" od:sqlSType="datetime" type="xsd:dateTime"/>
<xsd:element name="heureDepart" minOccurs="0" od:jetType="datetime" od:sqlSType="datetime" type="xsd:dateTime"/>
<xsd:element name="heureArrivee" minOccurs="0" od:jetType="datetime" od:sqlSType="datetime" type="xsd:dateTime"/>
<xsd:element name="tempsTournee" minOccurs="0" od:jetType="datetime" od:sqlSType="datetime" type="xsd:dateTime"/>
<xsd:element name="zone0" minOccurs="0" od:jetType="datetime" od:sqlSType="datetime" type="xsd:dateTime"/>
<xsd:element name="zone1" minOccurs="0" od:jetType="datetime" od:sqlSType="datetime" type="xsd:dateTime"/>
<xsd:element name="zone2" minOccurs="0" od:jetType="datetime" od:sqlSType="datetime" type="xsd:dateTime"/>
<xsd:element name="zone3" minOccurs="0" od:jetType="datetime" od:sqlSType="datetime" type="xsd:dateTime"/>
<xsd:element name="zone4" minOccurs="0" od:jetType="datetime" od:sqlSType="datetime" type="xsd:dateTime"/>
<xsd:element name="zone5" minOccurs="0" od:jetType="datetime" od:sqlSType="datetime" type="xsd:dateTime"/>
<xsd:element name="zone6" minOccurs="0" od:jetType="datetime" od:sqlSType="datetime" type="xsd:dateTime"/>
<xsd:element name="zone7" minOccurs="0" od:jetType="datetime" od:sqlSType="datetime" type="xsd:dateTime"/>
<xsd:element name="zone8" minOccurs="0" od:jetType="datetime" od:sqlSType="datetime" type="xsd:dateTime"/>
<xsd:element name="zone9" minOccurs="0" od:jetType="datetime" od:sqlSType="datetime" type="xsd:dateTime"/>
<xsd:element name="zone10" minOccurs="0" od:jetType="datetime" od:sqlSType="datetime" type="xsd:dateTime"/>
<xsd:element name="zone11" minOccurs="0" od:jetType="datetime" od:sqlSType="datetime" type="xsd:dateTime"/>
<xsd:element name="zone12" minOccurs="0" od:jetType="datetime" od:sqlSType="datetime" type="xsd:dateTime"/>
<xsd:element name="zone13" minOccurs="0" od:jetType="datetime" od:sqlSType="datetime" type="xsd:dateTime"/>
<xsd:element name="zone14" minOccurs="0" od:jetType="datetime" od:sqlSType="datetime" type="xsd:dateTime"/>
<xsd:element name="zone15" minOccurs="0" od:jetType="datetime" od:sqlSType="datetime" type="xsd:dateTime"/>
<xsd:element name="zone16" minOccurs="0" od:jetType="datetime" od:sqlSType="datetime" type="xsd:dateTime"/>
<xsd:element name="zone17" minOccurs="0" od:jetType="datetime" od:sqlSType="datetime" type="xsd:dateTime"/>
<xsd:element name="zone18" minOccurs="0" od:jetType="datetime" od:sqlSType="datetime" type="xsd:dateTime"/>
<xsd:element name="zone19" minOccurs="0" od:jetType="datetime" od:sqlSType="datetime" type="xsd:dateTime"/>
<xsd:element name="zone20" minOccurs="0" od:jetType="datetime" od:sqlSType="datetime" type="xsd:dateTime"/>
</xsd:sequence>
</xsd:complexType>
</xsd:element>
</xsd:schema>
